{
  "source": "Advanced_Fantasy_Players_Tome_v1-3.md",
  "counts": {
    "gear": 24,
    "weapons": 22,
    "ammunition": 4,
    "armour": 4,
    "poisons": 9,
    "mounts": 5,
    "dogs": 2,
    "tack": 4,
    "land_vehicles": 2,
    "water_vessels": 16,
    "ship_weapons": 5
  },
  "total": 97,
  "equipment": {
    "gear": [
      {
        "name": "Backpack",
        "cost": {
          "gp": 5
        },
        "category": "gear",
        "description": "Has two straps and can be worn on the back, keeping the hands free. Holds up to 400 coins."
      },
      {
        "name": "Crowbar",
        "cost": {
          "gp": 10
        },
        "category": "gear",
        "description": "2-3' long and made of solid iron. Can be used for forcing doors and other objects open."
      },
      {
        "name": "Garlic",
        "cost": {
          "gp": 5
        },
        "category": "gear"
      },
      {
        "name": "Grappling hook",
        "cost": {
          "gp": 25
        },
        "category": "gear",
        "description": "Has 3 or 4 prongs. Can be used for anchoring a rope."
      },
      {
        "name": "Hammer (small)",
        "cost": {
          "gp": 2
        },
        "category": "gear",
        "description": "Can be used for construction or as a mallet with iron or wooden spikes."
      },
      {
        "name": "Holy symbol",
        "cost": {
          "gp": 25
        },
        "category": "gear",
        "description": "A divine spell caster is required to own a holy symbol of their deity, often worn as a necklace. Each religion has its own holy symbol."
      },
      {
        "name": "Holy water (vial)",
        "cost": {
          "gp": 25
        },
        "category": "gear",
        "description": "A divine spell caster is required to own a holy symbol of their deity, often worn as a necklace. Each religion has its own holy symbol."
      },
      {
        "name": "Iron spikes (12)",
        "cost": {
          "gp": 1
        },
        "category": "gear",
        "description": "May be used for wedging doors open or shut (see Dungeon Adventuring, p222 ), as an anchor to attach a rope to, and many other purposes."
      },
      {
        "name": "Lantern",
        "cost": {
          "gp": 10
        },
        "category": "gear",
        "description": "Can be closed to hide the light. Burns one oil flask every four hours (24 turns). Casts light in a 30' radius."
      },
      {
        "name": "Mirror (hand-sized, steel)",
        "cost": {
          "gp": 5
        },
        "category": "gear",
        "description": "Useful for looking around corners or for reflecting a gaze attack."
      },
      {
        "name": "Oil (1 flask)",
        "cost": {
          "gp": 2
        },
        "category": "gear",
        "description": "A flask of oil fuels a lantern for four hours (24 turns). In addition to fuelling lanterns, oil can be used as a weapon: - Throwing: An oil flask may be lit on fire and thrown (see Weapon Combat Stats, p97 ). - Pools: Oil that is poured on the ground and lit covers a diameter of 3 feet and burns for 1 turn, inflicting damage on any character or monster moving through the pool. - Immunity: Burning oil does not harm monsters that have a natural flame attack."
      },
      {
        "name": "Pole (10' long, wooden)",
        "cost": {
          "gp": 1
        },
        "category": "gear",
        "description": "A 2' thick wooden pole useful for poking and prodding suspicious items in a dungeon."
      },
      {
        "name": "Rations (iron, 7 days)",
        "cost": {
          "gp": 15
        },
        "category": "gear",
        "description": "Dried and preserved food to be carried on long voyages when securing fresh food may be uncertain."
      },
      {
        "name": "Rations (standard, 7 days)",
        "cost": {
          "gp": 5
        },
        "category": "gear",
        "description": "Dried and preserved food to be carried on long voyages when securing fresh food may be uncertain."
      },
      {
        "name": "Rope (50')",
        "cost": {
          "gp": 1
        },
        "category": "gear",
        "description": "Can hold the weight of approximately three human-sized beings."
      },
      {
        "name": "Sack (large)",
        "cost": {
          "gp": 2
        },
        "category": "gear",
        "description": "Can hold up to 600 coins."
      },
      {
        "name": "Sack (small)",
        "cost": {
          "gp": 1
        },
        "category": "gear",
        "description": "Can hold up to 600 coins."
      },
      {
        "name": "Stakes (3) and mallet",
        "cost": {
          "gp": 3
        },
        "category": "gear",
        "description": "A wooden mallet and three 18' long stakes. Valuable when confronting vampires."
      },
      {
        "name": "Thieves' tools",
        "cost": {
          "gp": 25
        },
        "category": "gear",
        "description": "This kit contains all of the tools needed to pick locks."
      },
      {
        "name": "Tinder box (flint &steel)",
        "cost": {
          "gp": 3
        },
        "category": "gear"
      },
      {
        "name": "Torches (6)",
        "cost": {
          "gp": 1
        },
        "category": "gear"
      },
      {
        "name": "Waterskin",
        "cost": {
          "gp": 1
        },
        "category": "gear"
      },
      {
        "name": "Wine (2 pints)",
        "cost": {
          "gp": 1
        },
        "category": "gear"
      },
      {
        "name": "Wolfsbane (1 bunch)",
        "cost": {
          "gp": 10
        },
        "category": "gear"
      }
    ],
    "weapons": [
      {
        "name": "Battle axe",
        "cost": {
          "gp": 7
        },
        "weight_coins": 50,
        "category": "weapon",
        "damage": "1d8",
        "qualities": [
          "melee",
          "slow",
          "two_handed"
        ]
      },
      {
        "name": "Club",
        "cost": {
          "gp": 3
        },
        "weight_coins": 50,
        "category": "weapon",
        "damage": "1d4",
        "qualities": [
          "blunt",
          "melee"
        ]
      },
      {
        "name": "Crossbow",
        "cost": {
          "gp": 30
        },
        "weight_coins": 50,
        "category": "weapon",
        "damage": "1d6",
        "qualities": [
          "missile",
          "reload",
          "slow",
          "two_handed"
        ],
        "range": {
          "short": [
            5,
            80
          ],
          "medium": [
            81,
            160
          ],
          "long": [
            161,
            240
          ]
        }
      },
      {
        "name": "Dagger",
        "cost": {
          "gp": 3
        },
        "weight_coins": 10,
        "category": "weapon",
        "damage": "1d4",
        "qualities": [
          "melee",
          "missile"
        ],
        "range": {
          "short": [
            5,
            10
          ],
          "medium": [
            11,
            20
          ],
          "long": [
            21,
            30
          ]
        }
      },
      {
        "name": "Hand axe",
        "cost": {
          "gp": 4
        },
        "weight_coins": 30,
        "category": "weapon",
        "damage": "1d6",
        "qualities": [
          "melee",
          "missile"
        ],
        "range": {
          "short": [
            5,
            10
          ],
          "medium": [
            11,
            20
          ],
          "long": [
            21,
            30
          ]
        }
      },
      {
        "name": "Javelin",
        "cost": {
          "gp": 1
        },
        "weight_coins": 20,
        "category": "weapon",
        "damage": "1d4",
        "qualities": [
          "missile"
        ],
        "range": {
          "short": [
            5,
            30
          ],
          "medium": [
            31,
            60
          ],
          "long": [
            61,
            90
          ]
        }
      },
      {
        "name": "Lance",
        "cost": {
          "gp": 5
        },
        "weight_coins": 120,
        "category": "weapon",
        "damage": "1d6",
        "qualities": [
          "charge",
          "melee"
        ]
      },
      {
        "name": "Long bow",
        "cost": {
          "gp": 40
        },
        "weight_coins": 30,
        "category": "weapon",
        "damage": "1d6",
        "qualities": [
          "missile",
          "two_handed"
        ],
        "range": {
          "short": [
            5,
            70
          ],
          "medium": [
            71,
            140
          ],
          "long": [
            141,
            210
          ]
        }
      },
      {
        "name": "Mace",
        "cost": {
          "gp": 5
        },
        "weight_coins": 30,
        "category": "weapon",
        "damage": "1d6",
        "qualities": [
          "blunt",
          "melee"
        ]
      },
      {
        "name": "Pole arm",
        "cost": {
          "gp": 7
        },
        "weight_coins": 150,
        "category": "weapon",
        "damage": "1d10",
        "qualities": [
          "brace",
          "melee",
          "slow",
          "two_handed"
        ]
      },
      {
        "name": "Short bow",
        "cost": {
          "gp": 25
        },
        "weight_coins": 30,
        "category": "weapon",
        "damage": "1d6",
        "qualities": [
          "missile",
          "two_handed"
        ],
        "range": {
          "short": [
            5,
            50
          ],
          "medium": [
            51,
            100
          ],
          "long": [
            101,
            150
          ]
        }
      },
      {
        "name": "Short sword",
        "cost": {
          "gp": 7
        },
        "weight_coins": 30,